{
  "$schema": "/home/yolowingpixie/.cache/spectre/audit/b8251312984100139450de9e90b7cd0310ea33fe2dd4cf56b335f9eb79a0360b/schema/project-state.schema.json",
  "version": 1,
  "projectId": "db8c5cdc-9c77-4999-9ae3-c73abfad8196",
  "dataDir": "../spectre.audits",
  "activeAuditId": "8b0d89ac-18c9-44fb-bcc0-194501d69961",
  "audits": [
    {
      "id": "8b0d89ac-18c9-44fb-bcc0-194501d69961",
      "status": "complete",
      "checkpoint": {
        "updatedAt": "2026-10-03T06:46:32.812Z",
        "completed": [
          "Reviewed all 36 checklist sections through delegated section assignments; coverage.json records evidence and exclusions.",
          "Verified seven findings: four medium and three low severity. No project source fixes were made.",
          "Task verify passed. Linux Chromium browser suite passed; Windows Chrome fixture-path failure was reproduced.",
          "Strict report validation passed with zero warnings.",
          "Checked the report at 1280px and 400px without overflow or JavaScript exceptions; opened the live viewer in the Windows browser.",
          "Read six saved decisions: SPEC-02 ranges; AUDIT-01 propagate-cancellation; AUDIT-02 stable-identity; OPS-01 local-diagnostics; TEST-01 strengthen-oracles; TEST-02 require-linux-browser. No saved decision for SPEC-01.",
          "User authorized all seven recommended fixes, including SPEC-01.",
          "Implemented and verified all seven fixes. Report statuses are fixed; reader feedback is preserved.",
          "Task verify passed; Linux Chromium browser checks passed; Windows Chrome prerequisite rejection verified.",
          "AC-015 through AC-018 satisfied. Applied IMPL-008, TEST-006/025, GO-027/030/036."
        ],
        "nextSteps": [],
        "repository": {
          "head": "69cc5dffa57ad3f5511779ddcc45c393ac783d9e",
          "fingerprint": "513018138eb09ec647442d5e5f8f3eddcb049254fdd4526703f2325877e8d3f0"
        },
        "reportRevision": "8cac9bca2547763e8b6b86507a8fbf25f002dc1f16b5e350b3c2b8619d247d37"
      }
    }
  ]
}
